id|name|faction_id|source_id|legend|role|loadout|transport|virtual|leader_head|leader_footer|damaged_w|damaged_description|link|
000001397|Munitorum Servitors|AM|000000016|Lobotomised and augmented, Servitors attend the Departmento Munitorum in countless menial ways. These cybernetic living tools often form servile retinues for Enginseers, using their industrial servo- arms to repair hulking tanks, but unhesitatingly turning them on the foe should they draw too near.|Other|<b>Every model is equipped with:</b> Servitor’s servo-arm.||false|||||https://wahapedia.ru/wh40k10ed/factions/astra-militarum/Munitorum-Servitors|
000001398|Ogryn Bodyguard|AM|000000016|Ogryn Bodyguards are particularly capable warriors of their kind who have but one duty – to protect the officer to whom they are assigned. Whether by throwing themselves in the line of fire or slaughtering all enemies who come near their ward, they are invaluable retainers in the swirl of battlefield combat.|Other|<b>This model is equipped with:</b> ripper gun; close combat weapon; huge knife.||false|||||https://wahapedia.ru/wh40k10ed/factions/astra-militarum/Ogryn-Bodyguard|
000001406|Sly Marbo|AM|000000016|Sly Marbo is a one-man army. He operates alone, striking from ambush before disappearing back into the shadows. A legendary soldier, Marbo has gutted xenos horrors and slit the throats of traitors beyond count with his envenomed blade, and fires hails of poisoned shards from his ripper pistol.|Characters|<b>This model is equipped with:</b> ripper pistol; envenomed blade.||false|||||https://wahapedia.ru/wh40k10ed/factions/astra-militarum/Sly-Marbo|
000001596|Rein And Raus|AM|000000249||Characters|<b>Rein is equipped with:</b> sniper rifle; stub pistol; close combat weapon. <br><br><b>Raus is equipped with:</b> demolition charge; stub pistol; close combat weapon.||false|||||https://wahapedia.ru/wh40k10ed/factions/astra-militarum/Rein-And-Raus|
000001994|Carnodon|AM|000000247|The Carnodon is a versatile battle tank whose storied history stretches back to the Great Crusade. Adaptable and reliable, the Carnodon became a byword for conquest amongst the Expeditionary fleets, and though it is now largely kept in strategic reserve, it continues to perform with distinction when called into service.|Other|<b>This model is equipped with:</b> 2 autocannons; Carnodon twin autocannon; armoured tracks.||false|||1-4|While this model has 1-4 wounds remaining, each time this model makes an attack, subtract 1 from the <a href="/wh40k10ed/the-rules/core-rules/#1.-Hit-Roll">Hit roll</a>.|https://wahapedia.ru/wh40k10ed/factions/astra-militarum/Carnodon|
000002374|Death Korps Grenadier Squad|AM|000000249||Other|<b>The Grenadier Sergeant is equipped with:</b> sergeant’s pistol; sergeant’s close combat weapon. <br><br><b>Every Grenadier model is equipped with:</b> hot-shot lasgun; close combat weapon. <br><br><b>The Heavy Weapons Team is equipped with:</b> heavy flamer; close combat weapon.||false|||||https://wahapedia.ru/wh40k10ed/factions/astra-militarum/Death-Korps-Grenadier-Squad|
000002375|Quartermaster Cadre Squad|AM|000000249||Characters|<b>The Quartermaster Revenant is equipped with:</b> Quartermaster’s pistol; Quartermaster’s close combat weapon.<br><br><b>Every Medicae Servitor is equipped with:</b> medical scalpels||false|||||https://wahapedia.ru/wh40k10ed/factions/astra-militarum/Quartermaster-Cadre-Squad|
000002377|Elysian Sniper Squad|AM|000000249||Other|<b>Every model is equipped with:</b> lasgun; sniper rifle; close combat weapon.||false|||||https://wahapedia.ru/wh40k10ed/factions/astra-militarum/Elysian-Sniper-Squad|
000002378|Death Rider Commissar|AM|000000249||Characters|<b>This model is equipped with:</b> Commissar's pistol; Commissar's close combat weapon; savage claws.||false||<i>You can attach this model to the above unit even if one <a class="kwbOne" href="/wh40k10ed/factions/astra-militarum/Death-Rider-Squadron-Commander"><span class="kwb kwbo">DEATH</span> <span class="kwb kwbo">RIDER</span> <span class="kwb kwbo">SQUADRON</span> <span class="kwb kwbo">COMMANDER</span></a> model has already been attached to it. If you do, and that <a href="/wh40k10ed/the-rules/core-rules/#Attached-Units">Bodyguard</a> unit is destroyed, the Leader units attached to it become separate units, with their original <a href="/wh40k10ed/the-rules/core-rules/#Starting-Strength">Starting Strengths</a>.</i>|||https://wahapedia.ru/wh40k10ed/factions/astra-militarum/Death-Rider-Commissar|
000002379|Storm Chimera|AM|000000249||Dedicated Transports|<b>This model is equipped with:</b> autocannon; heavy bolter; armoured tracks.|This model has a transport capacity of 12 <span class="tooltip00298" data-tooltip-content="#tooltip_content00298" data-tooltip-anchor="#tooltip_content00298"><span class="kwb">ASTRA</span> <span class="kwb">MILITARUM</span> <span class="kwb">INFANTRY</span></span> models. Each <a class="kwbOne" href="/wh40k10ed/factions/astra-militarum/Infantry-Squad"><span class="kwb kwbo">HEAVY</span> <span class="kwb kwbo">WEAPONS</span> <span class="kwb kwbo">TEAM</span></a> model and Veteran <a class="kwbOne" href="/wh40k10ed/factions/astra-militarum/Infantry-Squad"><span class="kwb kwbo">HEAVY</span> <span class="kwb kwbo">WEAPONS</span> <span class="kwb kwbo">TEAM</span> <span class="kwb kwbo">MODEL</span></a> takes up the space of 2 models. Each <span class="tooltip01026" data-tooltip-content="#tooltip_content01026" data-tooltip-anchor="#tooltip_content01026"><span class="kwb">OGRYN</span></span> model takes up the space of 3 models. It cannot transport <span class="tooltip00300" data-tooltip-content="#tooltip_content00300" data-tooltip-anchor="#tooltip_content00300"><span class="kwb">ARTILLERY</span></span> models.|false|||||https://wahapedia.ru/wh40k10ed/factions/astra-militarum/Storm-Chimera|
000002385|Death Korps Marshal|AM|000000247|The regimental leaders known as Marshals are masters of the Krieg way of war, with strategic command over thousands of men and vehicles. Nonetheless, the martial philosophy of the Death Korps considers all soldiers expendable, and Marshals are often on the front line, their boots mired with the same filth as their subordinates.|Characters|<b>This model is equipped with:</b> laspistol; power sword.||false|||||https://wahapedia.ru/wh40k10ed/factions/astra-militarum/Death-Korps-Marshal|
000002386|Death Rider Squadron Commander|AM|000000247|Death Rider inductees are chosen for their initiative, and the most sharp-minded recruits are made Squadron Commanders. Leading shock cavalry assaults is an exceptionally hazardous role, but those who survive are often elevated to higher commands, where their callous disregard for casualties continues to serve them well.|Characters|<b>This model is equipped with:</b> laspistol; Death Rider hunting lance; savage claws.||false|||||https://wahapedia.ru/wh40k10ed/factions/astra-militarum/Death-Rider-Squadron-Commander|
000002389|Death Rider Squadron|AM|000000247|Death Rider squadrons excel in rapid assault roles that are beyond the capabilities of infantry platoons. Armed with explosive-tipped lances and mounted on Krieg steeds bio-engineered for resilience and aggression, they use their superior mobility to press breakthroughs, outflank enemy counterattacks and reconnoitre the battlefield.|Other|<b>Every model is equipped with:</b> laspistol; Death Rider hunting lance; savage claws.||false|||||https://wahapedia.ru/wh40k10ed/factions/astra-militarum/Death-Rider-Squadron|
000002485|Gaunt’s Ghosts|AM|000000016|Colonel-Commissar Ibram Gaunt combines the positions of feared political officer and the regimental commander of the Tanith First and Only. Joined by the regiment’s stealthy and deadly officers and soldiers – those known as Gaunt’s Ghosts – Gaunt’s infamous raids, secretive missions and unlikely victories have cemented his legend.|Characters|<b>Ibram Gaunt is equipped with:</b> bolt pistol; Gaunt’s chainsword. <br><br><b>1 Tanith Ghost is equipped with:</b> Corbec’s hot-shot lascarbine; straight silver knife. <br><br><b>1 Tanith Ghost is equipped with:</b> Rawne’s lascarbine; straight silver knife. <br><br><b>1 Tanith Ghost is equipped with:</b> Larkin’s long-las; straight silver knife. <br><br><b>1 Tanith Ghost is equipped with:</b> Bragg’s autocannon; straight silver knife. <br><br><b>1 Tanith Ghost is equipped with:</b> lascarbine; Mkoll’s straight silver knife.||false|||||https://wahapedia.ru/wh40k10ed/factions/astra-militarum/Gaunt-s-Ghosts|
000002605|Lord Solar Leontus|AM|000000016|Arcadian Leontus wields entire armies of the Astra Militarum against apocalyptic invasions and sector-wide insurgencies. A war scholar and master tactician, the Lord Commander Solar bestrides the battlefield on his cybernetic stallion, Konstantin, levelling his blade at the foe as he bellows his orders.|Characters|<b>This model is equipped with:</b> Sol’s Righteous Gaze; Conquest; Konstantin’s hooves.||false|||||https://wahapedia.ru/wh40k10ed/factions/astra-militarum/Lord-Solar-Leontus|
000002606|Ursula Creed|AM|000000016|The Lord Castellan of Cadia is a forbidding and implacable strategist, and a symbol of the enduring indomitability of Cadia’s armies. Ursula Creed’s superior generalship, forged over long years, has seen her lead numerous Imperial armies to victory against the enemies that threaten the Imperium.|Characters|<b>This model is equipped with:</b> Duty and Vengeance; power weapon.||false|||||https://wahapedia.ru/wh40k10ed/factions/astra-militarum/Ursula-Creed|
000002607|Cadian Castellan|AM|000000016|Strategic senior officers often ranking as Captains or Colonels, Cadian Castellans are authoritative leaders of the fallen world’s forces. Bearing a panoply of armaments and insignia that mark their high office, they wield their weapons as skilfully as they command the soldiers beneath them.|Characters|<b>This model is equipped with:</b> laspistol; chainsword, close combat weapon.||false|||||https://wahapedia.ru/wh40k10ed/factions/astra-militarum/Cadian-Castellan|
000002608|Platoon Command Squad|AM|000000016|Officers are known by many titles, but all are authoritative tacticians, trained to demolish the foe by wielding their troops as an extension of themselves. At many levels of hierarchy, the commanding officer is accompanied by a staff of veteran soldiers and specialists, supporting the commander’s strategies.|Characters|<b>The Platoon Commander is equipped with:</b> laspistol; close combat weapon. <br><br><b>Every Veteran Guardsman is equipped with:</b> lasgun; laspistol; close combat weapon. <br><br><b>The Veteran Heavy Weapons Team is equipped with:</b> heavy bolter; laspistol; close combat weapon.||false|||||https://wahapedia.ru/wh40k10ed/factions/astra-militarum/Platoon-Command-Squad|
000002609|Cadian Command Squad|AM|000000016|Cadia’s officers are exceptional leaders of Humanity. Trained to be the best, they expect no less from their troops. They are as inspiring as the standards carried in their wake, and as motivational as the orders issued by their vox operators.|Characters|<b>The Cadian Commander is equipped with:</b> laspistol; chainsword.<br><br><b>1 Cadian Veteran Guardsman is equipped with:</b> las pistol; chainsword.<br><br><b>1 other Cadian Veteran Guardsman is equipped with:</b> lasgun; master vox; close combat weapon.<br><br><b>1 other Cadian Veteran Guardsman is equipped with:</b> lasgun; medi-pack; close combat weapon.<br><br><b>1 other Cadian Veteran Guardsman is equipped with:</b> lasgun; regimental standard; close combat weapon.||false|||||https://wahapedia.ru/wh40k10ed/factions/astra-militarum/Cadian-Command-Squad|
000002610|Regimental Attachés|AM|000000016|Experienced officers know the value of drawing upon the advice of varied attachés. From void-hardened Officers of the Fleet to soot-stained Masters of Ordnance and psychic Astropaths, such specialists bring their expertise to bear in support of an officer’s grand strategies.|Other|<b>The Master of Ordnance and Officer of the Fleet are both equipped with:</b> laspistol; close combat weapon. <br><br><b>The Astropath is equipped with:</b> laspistol; Astropath’s stave.||false|||||https://wahapedia.ru/wh40k10ed/factions/astra-militarum/Regimental-Attach-s|
000002612|Cadian Shock Troops|AM|000000016|Born soldiers, the Shock Troops of Cadia have trained their entire lives for military service with the Astra Militarum. Decades of rigorous firing drills have forged them into expert sharpshooters. Skilled in both dogged defence and storming assaults, Cadian Shock Troops are held by many as being the ideal soldiers.|Battleline|<b>Every Shock Trooper Sergeant is equipped with:</b> laspistol; chainsword. <br><br><b>Every Shock Trooper is equipped with:</b> lasgun; close combat weapon.<br><br><i>This unit can have up to two Leader units attached to it, provided no more than one of those units is a <span class="tooltip01025" data-tooltip-content="#tooltip_content01025" data-tooltip-anchor="#tooltip_content01025"><span class="kwb">COMMAND</span> <span class="kwb">SQUAD</span></span> unit. If it does, and this Bodyguard unit is destroyed,the Leader units attached to it become separate units, withtheir original Starting Strengths.</i>||false|||||https://wahapedia.ru/wh40k10ed/factions/astra-militarum/Cadian-Shock-Troops|
000002613|Death Korps Of Krieg|AM|000000016|The grim regiments of the Death Korps of Krieg excel in the most gruelling of conditions, their famous siege regiments resolutely holding key positions no matter the onslaught unleashed upon them. They are extollers of a pitiless cult of sacrifice, but with their legendary endurance, death often claims their foes first.|Battleline|<b>Every Death Korps Watchmaster is equipped with:</b> laspistol; chainsword. <br><br><b>Every Death Korps Trooper is equipped with: lasgun;</b> close combat weapon.<br><br><i>This unit can have up to two Leader units attached to it, provided no more than one of those units is a <span class="tooltip01025" data-tooltip-content="#tooltip_content01025" data-tooltip-anchor="#tooltip_content01025"><span class="kwb">COMMAND</span> <span class="kwb">SQUAD</span></span> unit. If it does, and this Bodyguard unit is destroyed, the Leader units attached to it become separate units, with their original Starting Strengths.</i>||false|||||https://wahapedia.ru/wh40k10ed/factions/astra-militarum/Death-Korps-Of-Krieg|
000002614|Catachan Jungle Fighters|AM|000000016|These heavily muscled soldiers are drawn from a warrior people that survive on the most infamous of death worlds. Skilled in deadly close combat with the fiercest of beasts amidst hazardous terrain, Jungle Fighters are also skilled infiltrators and trackers, adept at luring their prey into fiendish traps.|Battleline|<b>Every Jungle Fighter Sergeant is equipped with:</b> laspistol; close combat weapon. <br><br><b>Every Jungle Fighter is equipped with:</b> lasgun; close combat weapon.<br><br><i>This unit can have up to two Leader units attached to it, provided no more than one of those units is a <span class="tooltip01025" data-tooltip-content="#tooltip_content01025" data-tooltip-anchor="#tooltip_content01025"><span class="kwb">COMMAND</span> <span class="kwb">SQUAD</span></span> unit. If it does, and this Bodyguard unit is destroyed, the Leader units attached to it become separate units, with their original Starting Strengths.</i>||false|||||https://wahapedia.ru/wh40k10ed/factions/astra-militarum/Catachan-Jungle-Fighters|
000002615|Kasrkin|AM|000000016|Amongst the lauded regiments of Cadia, the Kasrkin are the elite of the elite. These special operatives bear high-powered hot-shot lasguns and wear thick carapace armour. Disciplined and professional, the Kasrkin are peerless shots, and the equals or superiors of any unaugmented Human warriors.|Other|<b>The Kasrkin Sergeant is equipped with:</b> hot-shot laspistol; chainsword. <br><br><b>Every Kasrkin Trooper is equipped with:</b> hot-shot lasgun; close combat weapon.||false|||||https://wahapedia.ru/wh40k10ed/factions/astra-militarum/Kasrkin|
000002616|Attilan Rough Riders|AM|000000016|Hailing from the steppes of Attila, these horsemasters are potent cavalry troops. Their mobility makes them a powerful force, whether spearheading an attack or outflanking the foe. Though also equipped with grenades and sidearms, their deadliest weapon is their hunting lance, capable of bearing one of several deadly tips.|Other|<b>Every model is equipped with:</b> lasgun; laspistol; hunting lance; steed’s hooves.||false|||||https://wahapedia.ru/wh40k10ed/factions/astra-militarum/Attilan-Rough-Riders|
000002617|Rogal Dorn Battle Tank|AM|000000016|The immense Rogal Dorn Battle Tank is a lumbering behemoth equally suited to anchoring a battle line or grinding forward in support of an assault. Bristling with immensely powerful guns, they pound breaches in the foe’s defences with enormous shells and riddle infantry with storms of bullet-fire.|Other|<b>This model is equipped with:</b> castigator gatling cannon; heavy stubber; twin battle cannon; armoured tracks.||false|||1-6|While this model has 1-6 wounds remaining, each time this model makes an attack, subtract 1 from the <a href="/wh40k10ed/the-rules/core-rules/#1.-Hit-Roll">Hit roll</a>.|https://wahapedia.ru/wh40k10ed/factions/astra-militarum/Rogal-Dorn-Battle-Tank|
000002618|Field Ordnance Battery|AM|000000016|Amongst the largest man-portable weapons fielded by the Astra Militarum are those crewed by Ordnance Teams. From bombast field guns that fire heavy shells indirectly, to the multiple warheads of the malleus rocket launcher or the searing energy lances unleashed by heavy lascannons, such batteries are powerful assets.|Other|<b>Every model is equipped with:</b> malleus rocket launcher; lasgun; laspistol; battery close combat weapons.||false|||||https://wahapedia.ru/wh40k10ed/factions/astra-militarum/Field-Ordnance-Battery|
000002619|Aegis Defence Line|AM|000000016|Aegis Defence Lines are barricades comprising crenellated armoured panels that link together in a solid shield-wall. Thanks to their simple design they can be built and deployed at great speed, and are thus ideal for establishing defensive perimeters before more permanent structures can be erected.|Fortifications|||false|||||https://wahapedia.ru/wh40k10ed/factions/astra-militarum/Aegis-Defence-Line|
000002739|Earthshaker Platform|AM|000000249||Fortifications|<b>This model is equipped with:</b> earthshaker cannon; close combat weapons.||false|||||https://wahapedia.ru/wh40k10ed/factions/astra-militarum/Earthshaker-Platform|
000002740|Elysian Drop Sentinel|AM|000000249||Other|<b>This model is equipped with:</b> heavy bolter; close combat weapon.||false|||||https://wahapedia.ru/wh40k10ed/factions/astra-militarum/Elysian-Drop-Sentinel|
000002741|Leman Russ Eradicator|AM|000000016|The nova cannon carried by Leman Russ Eradicators fires shells containing a sub-atomic core. Their detonations produce powerful shock waves that pulverise enemy barricades and the infantry sheltering behind them. This battle tank is therefore a mainstay in the dense confines of urban firefights.|Other|<b>This model is equipped with:</b> eradicator nova cannon; lascannon; armoured tracks.||false|||1-4|While this model has 1-4 wounds remaining, each time this model makes an attack, subtract 1 from the <a href="/wh40k10ed/the-rules/core-rules/#1.-Hit-Roll">Hit roll</a>.|https://wahapedia.ru/wh40k10ed/factions/astra-militarum/Leman-Russ-Eradicator|
000002742|Leman Russ Executioner|AM|000000016|The Executioner’s plasma cannon fires with the fury of a miniature sun, incinerating tightly packed infantry and burning through vehicle armour with ease. Though extended engagements threaten containment breach of the main weapon, its gung-ho crews are known to risk death to kill ever more of the foe.|Other|<b>This model is equipped with:</b> executioner plasma cannon; lascannon; armoured tracks.||false|||1-4|While this model has 1-4 wounds remaining, each time this model makes an attack, subtract 1 from the <a href="/wh40k10ed/the-rules/core-rules/#1.-Hit-Roll">Hit roll</a>.|https://wahapedia.ru/wh40k10ed/factions/astra-militarum/Leman-Russ-Executioner|
000002743|Leman Russ Exterminator|AM|000000016|The Leman Russ Exterminator fills an adaptive role well-liked by commanders. Capable of laying down a withering hail of heavy fire, this tank’s shells can tear through lightly armoured chassis as easily as they rip through flesh and bone. Ranks of elite infantry are devastated with equal ease.|Other|<b>This model is equipped with:</b> exterminator autocannon; lascannon; armoured tracks.||false|||1-4|While this model has 1-4 wounds remaining, each time this model makes an attack, subtract 1 from the <a href="/wh40k10ed/the-rules/core-rules/#1.-Hit-Roll">Hit roll</a>.|https://wahapedia.ru/wh40k10ed/factions/astra-militarum/Leman-Russ-Exterminator|
000002744|Leman Russ Punisher|AM|000000016|The Punisher variant of the Leman Russ holds a dreaded reputation for mowing down enemy infantry in vast quantities. Its turret-mounted multi-barrelled cannon is an unsubtle sprayer of solid ammunition that applies the maxim of overwhelming firepower to overcome hordes of foes.|Other|<b>This model is equipped with:</b> lascannon; punisher gatling cannon; armoured tracks.||false|||1-4|While this model has 1-4 wounds remaining, each time this model makes an attack, subtract 1 from the <a href="/wh40k10ed/the-rules/core-rules/#1.-Hit-Roll">Hit roll</a>.|https://wahapedia.ru/wh40k10ed/factions/astra-militarum/Leman-Russ-Punisher|
000002745|Leman Russ Vanquisher|AM|000000016|No other battle tank of the Imperial Guard possesses more raw stopping power than the Leman Russ Vanquisher. Often deployed against heavily armoured enemies, the long range and high first-hit kill ratio of its main armament make it the anti-tank weapon of choice for many commanders.|Other|<b>This model is equipped with:</b> lascannon; vanquisher battle cannon; armoured tracks.||false|||1-4|While this model has 1-4 wounds remaining, each time this model makes an attack, subtract 1 from the <a href="/wh40k10ed/the-rules/core-rules/#1.-Hit-Roll">Hit roll</a>.|https://wahapedia.ru/wh40k10ed/factions/astra-militarum/Leman-Russ-Vanquisher|
000002746|Tempestus Scions|AM|000000016|Tempestus Scions are elite soldiers, well-trained in numerous combat styles, equipped to the highest standard and protected by reinforced carapace armour. Primed for a wide variety of specialist missions, their most common armament is an armour-piercing hotshot lasgun fitted with advanced sights.|Other|<b>The Tempestor is equipped with:</b> hot-shot laspistol; chainsword. <br><br><b>Every Tempestus Scion is equipped with:</b> hot-shot lasgun; close combat weapon.<br><br><i>This unit can have up to two Leader units attached to it, provided no more than one of those units is a <span class="tooltip01025" data-tooltip-content="#tooltip_content01025" data-tooltip-anchor="#tooltip_content01025"><span class="kwb">COMMAND</span> <span class="kwb">SQUAD</span></span> unit. If it does, and this <a href="/wh40k10ed/the-rules/core-rules/#Attached-Units">Bodyguard</a> unit is destroyed, the Leader units attached to it become separate units, with their original Starting Strengths.</i>||false|||||https://wahapedia.ru/wh40k10ed/factions/astra-militarum/Tempestus-Scions|
000002747|Thunderbolt Heavy Fighter|AM|000000248|The Thunderbolt is the main fighter aircraft of the Imperium. While less manoeuvrable than the Lightning, it boasts heavier armour, greater fuel capacity and superior armaments. Thunderbolts are capable of both atmospheric and void combat, and can be configured for a range of missions, from close support to light bombing sorties.|Other|<b>This model is equipped with:</b> Thunderbolt nose autocannons; 2 lascannons; armoured hull.||false|||1-5|While this model has 1-5 wounds remaining, each time this model makes an attack, subtract 1 from the <a href="/wh40k10ed/the-rules/core-rules/#1.-Hit-Roll">Hit roll</a>.|https://wahapedia.ru/wh40k10ed/factions/astra-militarum/Thunderbolt-Heavy-Fighter|
000003834|Tempestus Aquilons|AM|000000303|Hand-picked for their aggression and violent natures, Tempestus Aquilons deploy exclusively by grav-drop, descending from the skies to land precisely where their destructive firepower is most keenly required. They are accompanied in these actions by automaton servo-sentries that provide additional firepower as the assault is pressed home.|Other|<b>The Tempestor Aquilon is equipped with:</b> hot-shot lascarbine; sentry flamer; close combat weapon.<br><br><b>Every Tempestus Aquilon is equipped with:</b> hot-shot lascarbine; close combat weapon.||false|||||https://wahapedia.ru/wh40k10ed/factions/astra-militarum/Tempestus-Aquilons|
000000870|Vindicare Assassin|AoI|000000259|The muffled crack of a Vindicare Assassin’s exitus rifle is all that most ever detect of its presence – that, and the spray of their victim’s brain matter. They are lethal marksmen who find the perfect firing position from which to pinpoint their quarry, while against more numerous foes they swiftly rack up high body counts with shot after expert shot.|Characters|<b>This model is equipped with:</b> exitus pistol; exitus rifle; Vindicare combat knife.||false|||||https://wahapedia.ru/wh40k10ed/factions/imperial-agents/Vindicare-Assassin|
