id|name|faction_id|source_id|legend|role|loadout|transport|virtual|leader_head|leader_footer|damaged_w|damaged_description|link|
000000957|Chaos Bikers|CSM|000000012|Vicious long-range hunters as adept in reconnaissance as they are in bloody chases, Chaos Bikers ride powerful, growling machines whose combi-bolters spew explosive death. In rapid assaults, they smash through enemy defence lines, before circling back like a pack of predators to cut down survivors in bloody melee.|Other|<b>Every model is equipped with:</b> bolt pistol; combi-bolter; close combat weapon.||false|||||https://wahapedia.ru/wh40k10ed/factions/chaos-space-marines/Chaos-Bikers|
000000958|Raptors|CSM|000000012|A subculture of sky warriors that cuts across Legion boundaries, Raptors hunt like avian predators and are unified by the thrill of the chase. With screeching battle cries amplified to terrify their prey, they descend in meteoric charges, a flurry of reaping blades and intense, short-ranged firepower.|Other|<b>Every model is equipped with:</b> bolt pistol; Astartes chainsword.||false|||||https://wahapedia.ru/wh40k10ed/factions/chaos-space-marines/Raptors|
000000959|Warp Talons|CSM|000000012|Often appearing from the immaterium, wreathed in unholy fire and with their armour warped into daemonic likenesses, Warp Talons are tainted warriors who have fallen further than most. They are skyborne assassins, their flaming talons equally adept at slicing through armour or tearing through the fabric of realspace.|Other|<b>Every model is equipped with:</b> warp claws.||false|||||https://wahapedia.ru/wh40k10ed/factions/chaos-space-marines/Warp-Talons|
000000960|Chaos Spawn|CSM|000000012|Becoming a Chaos Spawn is the fate of many upon the Path to Glory. Wracked with the endless gifts of the Dark Gods, they are mutated mounds of muscle, scaly hides, talons, eyes, teeth and far more. Chaos Spawn are herded towards their terrified foes, advancing in loping runs as they seek only to tear, crush and consume.|Other|<b>Every model is equipped with:</b> hideous mutations.||false|||||https://wahapedia.ru/wh40k10ed/factions/chaos-space-marines/Chaos-Spawn|
000000961|Heldrake|CSM|000000012|Like vast, draconic predators of myth, Heldrakes spear suddenly out of the sky. These airborne Daemon Engines excel at intercepting the enemy’s aerial assets, tearing them from the air and incinerating their crew. Once their dominance of the sky is complete, they turn their claws and weapons against those on the ground.|Other|<b>This model is equipped with:</b> Hades autocannon; Heldrake claws.||false|||1-4|While this model has 1-4 wounds remaining, each time this model makes an attack, subtract 1 from the <a href="/wh40k10ed/the-rules/core-rules/#1.-Hit-Roll">Hit roll</a>.|https://wahapedia.ru/wh40k10ed/factions/chaos-space-marines/Heldrake|
000000962|Chaos Land Raider|CSM|000000012|Chaos Land Raiders are massive armoured transports bristling with the heavy armaments of main line battle tanks and seething with a malevolent spirit. Strung with trophies taken from those slain by the elite warriors the tanks carry to the front line, Land Raiders are the spiked fists of many Heretic Astartes assaults.|Other|<b>This model is equipped with:</b> 2 soulshatter lascannons; twin heavy bolter; armoured tracks.|This model has a transport capacity of 12 <span class="tooltip00315" data-tooltip-content="#tooltip_content00315" data-tooltip-anchor="#tooltip_content00315"><span class="kwb">HERETIC</span> <span class="kwb">ASTARTES</span> <span class="kwb">INFANTRY</span></span> models (excluding <a class="kwbOne" href="/wh40k10ed/factions/chaos-space-marines/Obliterators"><span class="kwb kwbo">OBLITERATOR</span></a> and <span class="tooltip00317" data-tooltip-content="#tooltip_content00317" data-tooltip-anchor="#tooltip_content00317"><span class="kwb">JUMP</span> <span class="kwb">PACK</span></span> models). Each <a class="kwbOne" href="/wh40k10ed/factions/chaos-space-marines/Possessed"><span class="kwb kwbo">POSSESSED</span></a> and <span class="tooltip00316" data-tooltip-content="#tooltip_content00316" data-tooltip-anchor="#tooltip_content00316"><span class="kwb">TERMINATOR</span></span> model takes up the space of 2 models.|false|||1-5|While this model has 1-5 wounds remaining, each time this model makes an attack, subtract 1 from the <a href="/wh40k10ed/the-rules/core-rules/#1.-Hit-Roll">Hit roll</a>.|https://wahapedia.ru/wh40k10ed/factions/chaos-space-marines/Chaos-Land-Raider|
000000963|Chaos Predator Destructor|CSM|000000012|Many Predator Destructors of the Heretic Astartes are ancient war engines whose rapid-firing heavy weaponry has unleashed destruction on battlefields dating back to the Horus Heresy. The thudding of their explosive shells resounds like a death knell as they scythe apart squads of infantry and light vehicles.|Other|<b>This model is equipped with:</b> Predator autocannon; armoured tracks.||false|||1-4|While this model has 1-4 wounds remaining, each time this model makes an attack, subtract 1 from the <a href="/wh40k10ed/the-rules/core-rules/#1.-Hit-Roll">Hit roll</a>.|https://wahapedia.ru/wh40k10ed/factions/chaos-space-marines/Chaos-Predator-Destructor|
000000964|Chaos Vindicator|CSM|000000012|Vindicators are brutal siege tanks, capable of single-handedly pulverising trench networks along with their defenders. A Vindicator’s demolisher cannon fires gigantic shells that can tear ragged holes in bastion walls, likened by its accompanying heretics to the crumbling faith of loyalists.|Other|<b>This model is equipped with:</b> demolisher cannon; armoured tracks.||false|||1-4|While this model has 1-4 wounds remaining, each time this model makes an attack, subtract 1 from the <a href="/wh40k10ed/the-rules/core-rules/#1.-Hit-Roll">Hit roll</a>.|https://wahapedia.ru/wh40k10ed/factions/chaos-space-marines/Chaos-Vindicator|
000000965|Obliterators|CSM|000000012|Hulking, baroque meldings of Chaos Space Marine, daemon-infused armour and mutated weaponry, Obliterators are able to reshape their forms from moment to moment. Stepping directly from warp fissures into ideal firing positions, they sweep all before them with warp-tainted firestorms.|Other|<b>Every model is equipped with:</b> fleshmetal guns; crushing fists.||false|||||https://wahapedia.ru/wh40k10ed/factions/chaos-space-marines/Obliterators|
000000966|Havocs|CSM|000000012|With a preference for inflicting carnage at long range, Havocs imperiously touch every part of the battlefield with death and destruction. Their huge weapons are archaic patterns of those known to the Imperium, but often become fused with their wielder over the span of countless wars.|Other|<b>The Havoc Champion is equipped with:</b> flamer; Astartes chainsword.<br><br><b>2 Havocs are equipped with:</b> Havoc autocannon; close combat weapon. <br><br><b>2 Havocs are equipped with:</b> Havoc lascannon; close combat weapon.||false|||||https://wahapedia.ru/wh40k10ed/factions/chaos-space-marines/Havocs|
000000967|Forgefiend|CSM|000000012|Forgefiends are fused with enormous rotary cannons that fire fist-sized phosphor shells, or else with ancient artefact-ordnance perverted to vomit ectoplasma from the beasts’ own innards. With such weaponry they scythe down masses of enemy troops and blast glowing craters into the toughest opposition.|Other|<b>This model is equipped with:</b> 2 Hades autocannons; Forgefiend jaws.||false|||1-4|While this model has 1-4 wounds remaining, each time this model makes an attack, subtract 1 from the <a href="/wh40k10ed/the-rules/core-rules/#1.-Hit-Roll">Hit roll</a>.|https://wahapedia.ru/wh40k10ed/factions/chaos-space-marines/Forgefiend|
000000968|Maulerfiend|CSM|000000012|Maulerfiends stalk the battlefield like immense hunting beasts. Once the enemy are in sight, these huge Daemon Engines thunder forward, even scaling defensive walls in their eagerness to get at the prey. Once amongst the foe, they slaughter anything in reach with their huge talons, crushing jaws and stabbing tendrils.|Other|<b>This model is equipped with:</b> lasher tendrils; Maulerfiend fists.||false|||1-4|While this model has 1-4 wounds remaining, each time this model makes an attack, subtract 1 from the <a href="/wh40k10ed/the-rules/core-rules/#1.-Hit-Roll">Hit roll</a>.|https://wahapedia.ru/wh40k10ed/factions/chaos-space-marines/Maulerfiend|
000000969|Defiler|CSM|000000012|Towering creations that stomp across the battlefield on piston-driven legs, their clanking claws easily capable of cutting a Space Marine in half, Defilers are Daemon Engines possessed by abominable entities. Foes are not safe at a distance either, as Defilers’ monstrous cannons and other heavy weapons can inflict a toll of carnage.|Other|<b>This model is equipped with:</b> Defiler cannon; reaper autocannon; twin heavy flamer; Defiler claws.||false|||1-5|While this model has 1-5 wounds remaining, each time this model makes an attack, subtract 1 from the <a href="/wh40k10ed/the-rules/core-rules/#1.-Hit-Roll">Hit roll</a>.|https://wahapedia.ru/wh40k10ed/factions/chaos-space-marines/Defiler|
000000970|Khorne Lord Of Skulls|CSM|000000012|Lords of Skulls are insane, monolithic creations fuelled by boiling blood and dedicated to slaughtering in the name of Khorne. They plough through the enemy’s ranks, crushing infantry beneath their tracks, hacking tanks into kindling with sweeps of their cleaver and hurling brazen projectiles or burning ichor at the survivors.|Other|<b>This model is equipped with:</b> gorestorm cannon; Hades gatling cannon; great cleaver of Khorne.||false|||1-8|While this model has 1-8 wounds remaining, subtract 4 from this model’s Objective Control characteristic and each time this model makes an attack, subtract 1 from the <a href="/wh40k10ed/the-rules/core-rules/#1.-Hit-Roll">Hit roll</a>.|https://wahapedia.ru/wh40k10ed/factions/chaos-space-marines/Khorne-Lord-Of-Skulls|
000001293|Blood Slaughterer|CSM|000000241|The Blood Slaughterer is a monstrous, gore-splattered Daemon Engine of brass and iron, forged for the sole purpose of wreaking carnage amongst the enemy. Once awoken by dreadful sacrifice rituals, Blood Slaughterers rend and kill indiscriminately, their every attack an act of profane worship to Khorne.|Other|<b>This model is equipped with:</b> impaler harpoon; slaughter blade.||false|||||https://wahapedia.ru/wh40k10ed/factions/chaos-space-marines/Blood-Slaughterer|
000001294|Greater Blight Drone|CSM|000000241|Blight Drones are nightmarish hovering killers, their weapons capable of sending swathes of enemy infantry to an unspeakably vile death. Often encountered in swarms on worlds falling to Chaos, Blight Drones act very much in the manner of carrion flies, drawn to ongoing bloodshed and concentrations of the dead.|Other|<b>This model is equipped with:</b> bile maw; blightreaper cannon; greater plague probe.||false|||||https://wahapedia.ru/wh40k10ed/factions/chaos-space-marines/Greater-Blight-Drone|
000001295|Decimator|CSM|000000241|Decimators are horrific amalgamations of Human and xenos technology, brought to unholy life by the darkest warp sorceries and all but impossible to completely destroy. While some Decimators accompany Chaos warbands as siege engines, others mysteriously appear upon the bloodiest of battlefields, stepping from the warp to burn and slay.|Other|<b>This model is equipped with:</b> 2 Decimator butcher cannons; armoured feet.||false|||1-4|While this model has 1-4 wounds remaining, each time this model makes an attack, subtract 1 from the <a href="/wh40k10ed/the-rules/core-rules/#1.-Hit-Roll">Hit roll</a>.|https://wahapedia.ru/wh40k10ed/factions/chaos-space-marines/Decimator|
000001297|Kytan Ravager|CSM|000000241|Forged by the most malign Warsmiths as an act of devotion to Khorne, Kytan Daemon Engines carve murderous paths across the battlefields of the 41st Millennium, their brazen hides slick with blood and gore. Kytan Ravagers’ thirst for slaughter is unquenchable, and they do not relent until they have eviscerated all who dare oppose them.|Other|<b>This model is equipped with:</b> Kytan gatling cannon; Kytan cleaver.||false|||1-8|While this model has 1-8 wounds remaining, subtract 5 from this model’s Objective Control characteristic and each time this model makes an attack, subtract 1 from the <a href="/wh40k10ed/the-rules/core-rules/#1.-Hit-Roll">Hit roll</a>.|https://wahapedia.ru/wh40k10ed/factions/chaos-space-marines/Kytan-Ravager|
000001298|Greater Brass Scorpion|CSM|000000241|More rampaging beasts than war machines, Brass Scorpions are monstrous fusions of armour plating and daemonic flesh that delight in destruction. Whether blasting apart the enemy at range with their scorpion cannon and soulburner cannon, or engulfing nearby targets with their hellmaw cannons, Brass Scorpions are terrifying embodiments of Khorne’s wrath.|Other|<b>This model is equipped with:</b> demolisher cannon; Scorpion cannon; hellmaw flame cannons; hellcrusher claws.||false|||1-9|While this model has 1-9 wounds remaining, subtract 5 from this model’s Objective Control characteristic and each time this model makes an attack, subtract 1 from the <a href="/wh40k10ed/the-rules/core-rules/#1.-Hit-Roll">Hit roll</a>.|https://wahapedia.ru/wh40k10ed/factions/chaos-space-marines/Greater-Brass-Scorpion|
000001302|Chaos Deimos Predator|CSM|000000240||Other|<b>This model is equipped with:</b> plasma destroyer; armoured tracks.||false|||1-4|While this model has 1-4 wounds remaining, each time this model makes an attack, subtract 1 from the <a href="/wh40k10ed/the-rules/core-rules/#1.-Hit-Roll">Hit roll</a>.|https://wahapedia.ru/wh40k10ed/factions/chaos-space-marines/Chaos-Deimos-Predator|
000001310|Dreadclaw Drop Pod|CSM|000000241|Since the dark days of the Horus Heresy, Dreadclaws have been a feared sight in void actions and planetary conflicts alike, their distinctive bladed hulls slicing through the flames of battle to disgorge elite Astartes assault troops. Though phased out by the loyalist Space Marine Chapters, Dreadclaws still form the spear-tip of many Heretic Astartes terror raids.|Other|<b>This model is equipped with:</b> blade struts.|This model has a transport capacity of 12 <span class="tooltip00315" data-tooltip-content="#tooltip_content00315" data-tooltip-anchor="#tooltip_content00315"><span class="kwb">HERETIC</span> <span class="kwb">ASTARTES</span> <span class="kwb">INFANTRY</span></span> models. Each <span class="tooltip00317" data-tooltip-content="#tooltip_content00317" data-tooltip-anchor="#tooltip_content00317"><span class="kwb">JUMP</span> <span class="kwb">PACK</span></span>, <a class="kwbOne" href="/wh40k10ed/factions/chaos-space-marines/Possessed"><span class="kwb kwbo">POSSESSED</span></a> and <span class="tooltip00316" data-tooltip-content="#tooltip_content00316" data-tooltip-anchor="#tooltip_content00316"><span class="kwb">TERMINATOR</span></span> model takes up the space of 2 models. Each <a class="kwbOne" href="/wh40k10ed/factions/chaos-space-marines/Obliterators"><span class="kwb kwbo">OBLITERATOR</span></a> model takes up the space of 3 models. This model can instead transport 1 <a class="kwbOne" href="/wh40k10ed/factions/chaos-space-marines/Helbrute"><span class="kwb kwbo">HELBRUTE</span></a> or <span class="tooltip00318" data-tooltip-content="#tooltip_content00318" data-tooltip-anchor="#tooltip_content00318"><span class="kwb">DREADNOUGHT</span></span> model.|false|||||https://wahapedia.ru/wh40k10ed/factions/chaos-space-marines/Dreadclaw-Drop-Pod|
000001311|Kharybdis Assault Claw|CSM|000000241|The Kharybdis is a powerful ship-to-ship assault pod able to insert a large complement of Heretic Astartes warriors into enemy vessels or war zones on the ground. Far more than a simple shuttle, the Kharybdis is also a threat in its own right, capable of showering target areas with its storm launchers or even ramming enemy vehicles and burning through thick steel and ceramite with melta cutters designed to breach starships.|Other|<b>This model is equipped with:</b> 5 Kharybdis storm launchers; blade struts; melta array.|This model has a transport capacity of 22 <span class="tooltip00315" data-tooltip-content="#tooltip_content00315" data-tooltip-anchor="#tooltip_content00315"><span class="kwb">HERETIC</span> <span class="kwb">ASTARTES</span> <span class="kwb">INFANTRY</span></span> models. Each <span class="tooltip00317" data-tooltip-content="#tooltip_content00317" data-tooltip-anchor="#tooltip_content00317"><span class="kwb">JUMP</span> <span class="kwb">PACK</span></span>, <a class="kwbOne" href="/wh40k10ed/factions/chaos-space-marines/Possessed"><span class="kwb kwbo">POSSESSED</span></a> and <span class="tooltip00316" data-tooltip-content="#tooltip_content00316" data-tooltip-anchor="#tooltip_content00316"><span class="kwb">TERMINATOR</span></span> model takes up the space of 2 models. Each <a class="kwbOne" href="/wh40k10ed/factions/chaos-space-marines/Obliterators"><span class="kwb kwbo">OBLITERATOR</span></a> model takes up the space of 3 models. This model can instead transport 1 <a class="kwbOne" href="/wh40k10ed/factions/chaos-space-marines/Helbrute"><span class="kwb kwbo">HELBRUTE</span></a> or <span class="tooltip00318" data-tooltip-content="#tooltip_content00318" data-tooltip-anchor="#tooltip_content00318"><span class="kwb">DREADNOUGHT</span></span> model.|false|||1-7|While this model has 1-7 wounds remaining, each time this model makes an attack, subtract 1 from the <a href="/wh40k10ed/the-rules/core-rules/#1.-Hit-Roll">Hit roll</a>.|https://wahapedia.ru/wh40k10ed/factions/chaos-space-marines/Kharybdis-Assault-Claw|
000001317|Hell Blade|CSM|000000240||Other|<b>This model is equipped with:</b> 2 twin autocannons; armoured hull.||false|||||https://wahapedia.ru/wh40k10ed/factions/chaos-space-marines/Hell-Blade|
000001318|Hell Talon|CSM|000000240||Other|<b>This model is equipped with:</b> autocannon; twin lascannon; armoured hull.||false|||1-5|While this model has 1-5 wounds remaining, each time this model makes an attack, subtract 1 from the <a href="/wh40k10ed/the-rules/core-rules/#1.-Hit-Roll">Hit roll</a>.|https://wahapedia.ru/wh40k10ed/factions/chaos-space-marines/Hell-Talon|
000001321|Chaos Thunderhawk|CSM|000000241|So often a symbol of hope and deliverance in the skies above Imperial worlds, Thunderhawk Gunships sworn to Chaos encapsulate the opposite. Sowing ruin with their cannons and missiles, the resilient craft descend like ruthless birds of prey, their fuselages loaded with Chaos Space Marines hungry for conquest and revenge.|Other|<b>This model is equipped with:</b> 2 lascannons; Thunderhawk heavy cannon; 4 twin heavy bolters; armoured hull; Thunderhawk cluster bombs.|This model has a transport capacity of 30 <span class="tooltip00315" data-tooltip-content="#tooltip_content00315" data-tooltip-anchor="#tooltip_content00315"><span class="kwb">HERETIC</span> <span class="kwb">ASTARTES</span> <span class="kwb">INFANTRY</span></span> or <span class="tooltip00319" data-tooltip-content="#tooltip_content00319" data-tooltip-anchor="#tooltip_content00319"><span class="kwb">HERETIC</span> <span class="kwb">ASTARTES</span> <span class="kwb">MOUNTED</span></span> models. Each <span class="tooltip00317" data-tooltip-content="#tooltip_content00317" data-tooltip-anchor="#tooltip_content00317"><span class="kwb">JUMP</span> <span class="kwb">PACK</span></span>, <a class="kwbOne" href="/wh40k10ed/factions/chaos-space-marines/Possessed"><span class="kwb kwbo">POSSESSED</span></a> and <span class="tooltip00316" data-tooltip-content="#tooltip_content00316" data-tooltip-anchor="#tooltip_content00316"><span class="kwb">TERMINATOR</span></span> model takes up the space of 2 models. Each <a class="kwbOne" href="/wh40k10ed/factions/chaos-space-marines/Obliterators"><span class="kwb kwbo">OBLITERATOR</span></a> model takes up the space of 3 models. Each <span class="tooltip00320" data-tooltip-content="#tooltip_content00320" data-tooltip-anchor="#tooltip_content00320"><span class="kwb">MOUNTED</span></span> model takes up the space of 4 models.|false|||1-10|While this model has 1-10 wounds remaining, each time this model makes an attack, subtract 1 from the <a href="/wh40k10ed/the-rules/core-rules/#1.-Hit-Roll">Hit roll</a>.|https://wahapedia.ru/wh40k10ed/factions/chaos-space-marines/Chaos-Thunderhawk|
000001354|Lucius The Eternal|CSM|000000280|An arrogant slaughterer and swordsman supreme, Lucius seeks out the most skilled of the foe’s champions, casually striking down lesser enemies that dare bar his path. Against worthy opponents, Lucius strikes with the speed of a snake, his daemonically sentient lash and duellist’s sword making a mockery of the greatest warriors.|Characters|<b>This model is equipped with:</b> doom siren; duellist’s sword and Lash of Torment.||false|||||https://wahapedia.ru/wh40k10ed/factions/chaos-space-marines/Lucius-The-Eternal|
000001355|Exalted Champion|CSM|000000240|These murderous champions of the Dark Gods exhort their fellow traitors by example. The fell deeds they commit and the violent bloodbaths they unleash – ostensibly supporting their overlord’s strategies – are often wrought solely to further the Exalted Champion’s own goals as they aspire to even greater glory.|Characters|<b>This model is equipped with:</b> bolt pistol; combi-weapon; exalted weapon.||false||<i>You can attach this model to one of the above units even if one other <span class="kwb">CHARACTER</span> model has already been attached to it (a unit cannot have two <span class="kwb">EXALTED</span> <span class="kwb">CHAMPIONS</span> attached to it). If you do, and that <a href="/wh40k10ed/the-rules/core-rules/#Attached-Units">Bodyguard</a> unit is destroyed, the Leader units attached to it become separate units, with their original <a href="/wh40k10ed/the-rules/core-rules/#Starting-Strength">Starting Strengths</a>.</i>|||https://wahapedia.ru/wh40k10ed/factions/chaos-space-marines/Exalted-Champion|
000001556|Haarken Worldclaimer|CSM|000000012|Haarken is the Herald of the Apocalypse and the mouthpiece of Abaddon. He declares his master’s dominion by driving his daemon touched Helspear into soon-to-be-conquered worlds, following up with vicious destruction as he leads hosts of Raptors in strikes that sow fear and confusion.|Characters|<b>This model is equipped with:</b> Helspear; Herald’s Talon.||false|||||https://wahapedia.ru/wh40k10ed/factions/chaos-space-marines/Haarken-Worldclaimer|
000001581|Master Of Possession|CSM|000000012|Masters of Possession are psykers who specialise in channelling daemons into living hosts; they bolster their possessed kin with empyric energies that strengthen and reinvigorate such tainted unions. In battle, they unleash daemonic forces into the foe, ripping apart their souls to channel them to greater use.|Characters|<b>This model is equipped with:</b> bolt pistol; Rite of Possession; staff of possession.||false|||||https://wahapedia.ru/wh40k10ed/factions/chaos-space-marines/Master-Of-Possession|
000001583|Lord Discordant On Helstalker|CSM|000000012|Technocrats and spirit-thieves, Lords Discordant hunt the foe’s war engines. Atop daemonic Helstalkers, these heretics cut through enemy infantry before lunging at their quarry with saw-toothed polearms. Each mount tears its mechanical prey open as the Lord Discordant siphons off the victim’s spirit to reinvigorate other Daemon Engines.|Characters|<b>This model is equipped with:</b> bolt pistol; Helstalker autocannon; techno-virus injector; bladed limbs; impaler chainglaive.||false|||||https://wahapedia.ru/wh40k10ed/factions/chaos-space-marines/Lord-Discordant-On-Helstalker|
000001584|Master Of Executions|CSM|000000012|These corrupted axemen are the executioners of Heretic Astartes warbands. Able to perceive the empyric soul-stuff of the foe’s greatest champions, they single-mindedly seek them out in battle, bellowing a fatal decree before crashing forward and hacking through armour, flesh and bone.|Characters|<b>This model is equipped with:</b> bolt pistol; axe of dismemberment.||false||<i>You can attach this model to one of the above units even if one other <span class="tooltip01032" data-tooltip-content="#tooltip_content01032" data-tooltip-anchor="#tooltip_content01032"><span class="kwb">CHARACTER</span></span> model has already been attached to it (a unit cannot have two <span class="kwb">MASTERS</span> <span class="kwb2">OF</span> <span class="kwb">EXECUTIONS</span> attached to it). If you do, and that <a href="/wh40k10ed/the-rules/core-rules/#Attached-Units">Bodyguard</a> unit is destroyed, the Leader units attached to it become separate units, with their original <a href="/wh40k10ed/the-rules/core-rules/#Starting-Strength">Starting Strengths</a>.</i>|||https://wahapedia.ru/wh40k10ed/factions/chaos-space-marines/Master-Of-Executions|
000001586|Venomcrawler|CSM|000000012|These arachnoid amalgams of daemon flesh, cursed iron and malignant sentience pound across war zones in search of bodies to tear and spirits to consume. After butchering the prey with their excruciator cannons, claws and lashing tendrils, they draw the souls of the slain into their abdomens.|Other|<b>This model is equipped with:</b> 2 excruciator cannons; soulflayer tendrils and claws.||false|||||https://wahapedia.ru/wh40k10ed/factions/chaos-space-marines/Venomcrawler|
000001587|Noctilith Crown|CSM|000000012|Wreathed in fluctuating, eldritch energies, Noctilith Crowns are ritual loci of empyric power. They draw in the raw energy of Chaos itself, forming nodal strongholds of the Dark Gods’ influence that empower their fell servants and wrack their enemies with lashes of baleful warp magicks.|Fortifications|<b>This model is equipped with:</b> lashing warp energies.||false|||||https://wahapedia.ru/wh40k10ed/factions/chaos-space-marines/Noctilith-Crown|
