id|name|faction_id|source_id|legend|role|loadout|transport|virtual|leader_head|leader_footer|damaged_w|damaged_description|link|
000001573|Achilles Ridgerunners|GC|000000053|The operators of these lightweight but rugged scout vehicles help to coordinate lethal armoured ambushes that eliminate isolated foes or sever communication and supply lines. They can mount a versatile range of heavy weapons, and their speed and manoeuvrability enable them to skirt enemy ranks before unleashing their payloads at a more vulnerable quarter.|Other|<b>Every model is equipped with:</b> heavy mining laser; twin heavy stubbers; armoured hull; flare launcher.||false|||||https://wahapedia.ru/wh40k10ed/factions/genestealer-cults/Achilles-Ridgerunners|
000001574|Atalan Jackals|GC|000000053|Atalan Jackals share a mental link that allows them to coordinate in hunting packs and ride in tight formations at high speeds with no risk of mishap. They harass the foe with hit-and-run strikes, their Wolfquads unleashing heavy firepower to augment the guns, bludgeons and mining charges of their packmates.|Other|<i><b>*</b> This unit can only contain 2 Atalan Wolfquads if it also contains 8 Atalan Jackals.</i><br><br><b>Every Atalan Jackal is equipped with:</b> Atalan small arms; close combat weapon. <br><br><b>Every Atalan Wolfquad is equipped with:</b> Atalan small arms; heavy stubber; close combat weapon.||false|||||https://wahapedia.ru/wh40k10ed/factions/genestealer-cults/Atalan-Jackals|
000001576|Tectonic Fragdrill|GC|000000265||Fortifications|<b>This model is equipped with:</b> fragdrill.||false|||||https://wahapedia.ru/wh40k10ed/factions/genestealer-cults/Tectonic-Fragdrill|
000002525|Reductus Saboteur|GC|000000053|There is no engine of the oppressors that a Reductus Saboteur cannot lay low, and few materials they cannot fashion into a bomb given a little time to tinker. Flitting through the shadows, they lace the battlefield with booby traps and deploy powerful explosives that make short work of enemy armour.|Characters|<b>This model is equipped with:</b> autopistol; demolition charges; remote explosives; close combat weapon.||false|||||https://wahapedia.ru/wh40k10ed/factions/genestealer-cults/Reductus-Saboteur|
000003715|Benefictus|GC|000000053|A Benefictus uses the swollen mass of their brain to focus the will of the Broodmind. They unleash it in a lancing beam of incredible power that has the potential to carve through battle tank armour. Where the psionic strike hits, intense shock waves of nauseating alien horror spread out, leaving survivors vulnerable to lurking broodkin.|Characters|<b>This model is equipped with:</b> Psionic Cascade; close combat weapon.||false|||||https://wahapedia.ru/wh40k10ed/factions/genestealer-cults/Benefictus|
000003716|Acolyte Hybrids With Hand Flamers|GC|000000053|Equipped with hand flamers and using their hulking strength andxenos dexterity to wield pilfered explosive charges, Acolyte Hybrids excel in bold missions of arson and ruination. Denying the oppressors any opportunity of a foothold, their destructive acts are often so wholesale that few witnesses survive their operations.|Battleline|<b>Every model is equipped with:</b> hand flamer; cult claws and knife.||false|||||https://wahapedia.ru/wh40k10ed/factions/genestealer-cults/Acolyte-Hybrids-With-Hand-Flamers|
000003717|Cadian Castellan|GC|000000016||Characters|<b>This model is equipped with:</b> laspistol; chainsword, close combat weapon.||false|||||https://wahapedia.ru/wh40k10ed/factions/genestealer-cults/Cadian-Castellan|
000003718|Cadian Command Squad|GC|000000016||Characters|<b>The Cadian Commander is equipped with:</b> laspistol; chainsword.<br><br><b>1 Cadian Veteran Guardsman is equipped with:</b> las pistol; chainsword.<br><br><b>1 other Cadian Veteran Guardsman is equipped with:</b> lasgun; master vox; close combat weapon.<br><br><b>1 other Cadian Veteran Guardsman is equipped with:</b> lasgun; medi-pack; close combat weapon.<br><br><b>1 other Cadian Veteran Guardsman is equipped with:</b> lasgun; regimental standard; close combat weapon.||false|||||https://wahapedia.ru/wh40k10ed/factions/genestealer-cults/Cadian-Command-Squad|
000003719|Platoon Command Squad|GC|000000016||Characters|<b>The Platoon Commander is equipped with:</b> laspistol; close combat weapon. <br><br><b>Every Veteran Guardsman is equipped with:</b> lasgun; laspistol; close combat weapon. <br><br><b>The Veteran Heavy Weapons Team is equipped with:</b> heavy bolter; laspistol; close combat weapon.||false|||||https://wahapedia.ru/wh40k10ed/factions/genestealer-cults/Platoon-Command-Squad|
000003720|Primaris Psyker|GC|000000016||Characters|<b>This model is equipped with:</b> laspistol; Psychic Maelstrom; force weapon.||false|||||https://wahapedia.ru/wh40k10ed/factions/genestealer-cults/Primaris-Psyker|
000003721|Tank Commander|GC|000000016||Characters|<b>This model is equipped with:</b> lascannon; Leman Russ battle cannon; armoured tracks.||false|||||https://wahapedia.ru/wh40k10ed/factions/genestealer-cults/Tank-Commander|
000003722|Death Korps Marshal|GC|000000247||Characters|<b>This model is equipped with:</b> laspistol; power sword.||false|||||https://wahapedia.ru/wh40k10ed/factions/genestealer-cults/Death-Korps-Marshal|
000003723|Death Rider Squadron Commander|GC|000000247||Characters|<b>This model is equipped with:</b> laspistol; Death Rider hunting lance; savage claws.||false|||||https://wahapedia.ru/wh40k10ed/factions/genestealer-cults/Death-Rider-Squadron-Commander|
000003724|Death Rider Commissar|GC|000000249||Characters|<b>This model is equipped with:</b> Commissar's pistol; Commissar's close combat weapon; savage claws.||false|||||https://wahapedia.ru/wh40k10ed/factions/genestealer-cults/Death-Rider-Commissar|
000003725|Quartermaster Cadre Squad|GC|000000249||Characters|<b>The Quartermaster Revenant is equipped with:</b> Quartermaster’s pistol; Quartermaster’s close combat weapon.<br><br><b>Every Medicae Servitor is equipped with:</b> medical scalpels||false|||||https://wahapedia.ru/wh40k10ed/factions/genestealer-cults/Quartermaster-Cadre-Squad|
000003726|Cadian Shock Troops|GC|000000016||Battleline|<b>Every Shock Trooper Sergeant is equipped with:</b> laspistol; chainsword. <br><br><b>Every Shock Trooper is equipped with:</b> lasgun; close combat weapon.<br><br><i>This unit can have up to two Leader units attached to it, provided no more than one of those units is a <span class="tooltip01025" data-tooltip-content="#tooltip_content01025" data-tooltip-anchor="#tooltip_content01025"><span class="kwb">COMMAND</span> <span class="kwb">SQUAD</span></span> unit. If it does, and this Bodyguard unit is destroyed,the Leader units attached to it become separate units, withtheir original Starting Strengths.</i>||false|||||https://wahapedia.ru/wh40k10ed/factions/genestealer-cults/Cadian-Shock-Troops|
000003727|Catachan Jungle Fighters|GC|000000016||Battleline|<b>Every Jungle Fighter Sergeant is equipped with:</b> laspistol; close combat weapon. <br><br><b>Every Jungle Fighter is equipped with:</b> lasgun; close combat weapon.<br><br><i>This unit can have up to two Leader units attached to it, provided no more than one of those units is a <span class="tooltip01025" data-tooltip-content="#tooltip_content01025" data-tooltip-anchor="#tooltip_content01025"><span class="kwb">COMMAND</span> <span class="kwb">SQUAD</span></span> unit. If it does, and this Bodyguard unit is destroyed, the Leader units attached to it become separate units, with their original Starting Strengths.</i>||false|||||https://wahapedia.ru/wh40k10ed/factions/genestealer-cults/Catachan-Jungle-Fighters|
000003728|Death Korps Of Krieg|GC|000000016||Battleline|<b>Every Death Korps Watchmaster is equipped with:</b> laspistol; chainsword. <br><br><b>Every Death Korps Trooper is equipped with: lasgun;</b> close combat weapon.<br><br><i>This unit can have up to two Leader units attached to it, provided no more than one of those units is a <span class="tooltip01025" data-tooltip-content="#tooltip_content01025" data-tooltip-anchor="#tooltip_content01025"><span class="kwb">COMMAND</span> <span class="kwb">SQUAD</span></span> unit. If it does, and this Bodyguard unit is destroyed, the Leader units attached to it become separate units, with their original Starting Strengths.</i>||false|||||https://wahapedia.ru/wh40k10ed/factions/genestealer-cults/Death-Korps-Of-Krieg|
000003729|Infantry Squad|GC|000000016||Battleline|<b>Every Sergeant is equipped with: laspistol;</b> close combat weapon.   <br><br><b>Every Guardsman is equipped with: lasgun;</b> close combat weapon.   <br><br><b>Every Heavy Weapons Team is equipped with:</b> heavy bolter; laspistol; close combat weapon.  <br><br><i>This unit can have up to two Leader units attached to it, provided no more than one of those units is a <span class="tooltip01025" data-tooltip-content="#tooltip_content01025" data-tooltip-anchor="#tooltip_content01025"><span class="kwb">COMMAND</span> <span class="kwb">SQUAD</span></span> unit. If it does, and this Bodyguard unit is destroyed, the Leader units attached to it become separate units, with their original <a href="/wh40k10ed/the-rules/core-rules/#Starting-Strength">Starting Strengths</a>.</i> <br><br><b>Designer’s Note:</b> <i>Each Heavy Weapons Team model in this unit counts as 2 models for the purposes of wargear options.</i>||false|||||https://wahapedia.ru/wh40k10ed/factions/genestealer-cults/Infantry-Squad|
000003730|Chimera|GC|000000016||Dedicated Transports|<b>This model is equipped with:</b> Chimera multi-laser; heavy bolter; lasgun array; armoured tracks.|This model has a transport capacity of 12 <span class="tooltip00298" data-tooltip-content="#tooltip_content00298" data-tooltip-anchor="#tooltip_content00298"><span class="kwb">ASTRA</span> <span class="kwb">MILITARUM</span> <span class="kwb">INFANTRY</span></span> models. Each <a class="kwbOne" href="/wh40k10ed/factions/astra-militarum/Infantry-Squad"><span class="kwb kwbo">HEAVY</span> <span class="kwb kwbo">WEAPONS</span> <span class="kwb kwbo">TEAM</span></a> model and <a class="kwbOne" href="/wh40k10ed/factions/astra-militarum/Platoon-Command-Squad"><span class="kwb kwbo">VETERAN</span> <span class="kwb kwbo">HEAVY</span> <span class="kwb kwbo">WEAPONS</span> <span class="kwb kwbo">TEAM</span></a> model takes up the space of 2 models. Each <span class="tooltip01026" data-tooltip-content="#tooltip_content01026" data-tooltip-anchor="#tooltip_content01026"><span class="kwb">OGRYN</span></span> model takes up the space of 3 models. It cannot transport <span class="tooltip00300" data-tooltip-content="#tooltip_content00300" data-tooltip-anchor="#tooltip_content00300"><span class="kwb">ARTILLERY</span></span> models.|false|||||https://wahapedia.ru/wh40k10ed/factions/genestealer-cults/Chimera|
000003731|Taurox|GC|000000016||Dedicated Transports|<b>This model is equipped with:</b> twin autocannon; armoured tracks.|This model has a transport capacity of 12 <span class="tooltip00298" data-tooltip-content="#tooltip_content00298" data-tooltip-anchor="#tooltip_content00298"><span class="kwb">ASTRA</span> <span class="kwb">MILITARUM</span> <span class="kwb">INFANTRY</span></span> models. Each <a class="kwbOne" href="/wh40k10ed/factions/astra-militarum/Infantry-Squad"><span class="kwb kwbo">HEAVY</span> <span class="kwb kwbo">WEAPONS</span> <span class="kwb kwbo">TEAM</span></a> model and <a class="kwbOne" href="/wh40k10ed/factions/astra-militarum/Platoon-Command-Squad"><span class="kwb kwbo">VETERAN</span> <span class="kwb kwbo">HEAVY</span> <span class="kwb kwbo">WEAPONS</span> <span class="kwb kwbo">TEAM</span></a> model takes up the space of 2 models. Each <span class="tooltip01026" data-tooltip-content="#tooltip_content01026" data-tooltip-anchor="#tooltip_content01026"><span class="kwb">OGRYN</span></span> model takes up the space of 3 models. It cannot transport <span class="tooltip00300" data-tooltip-content="#tooltip_content00300" data-tooltip-anchor="#tooltip_content00300"><span class="kwb">ARTILLERY</span></span> models.|false|||||https://wahapedia.ru/wh40k10ed/factions/genestealer-cults/Taurox|
000003732|Taurox Prime|GC|000000016||Dedicated Transports|<b>This model is equipped with:</b> Taurox battle cannon; twin Taurox hot-shot volley gun; armoured tracks.|This model has a transport capacity of 12 <span class="tooltip00301" data-tooltip-content="#tooltip_content00301" data-tooltip-anchor="#tooltip_content00301"><span class="kwb">MILITARUM</span> <span class="kwb">TEMPESTUS</span> <span class="kwb">INFANTRY</span></span> or <span class="tooltip01027" data-tooltip-content="#tooltip_content01027" data-tooltip-anchor="#tooltip_content01027"><span class="kwb">ASTRA</span> <span class="kwb">MILITARUM</span> <span class="kwb">INFANTRY</span> <span class="kwb">CHARACTER</span></span> models.|false|||||https://wahapedia.ru/wh40k10ed/factions/genestealer-cults/Taurox-Prime|
000003733|Storm Chimera|GC|000000249||Dedicated Transports|<b>This model is equipped with:</b> autocannon; heavy bolter; armoured tracks.|This model has a transport capacity of 12 <span class="tooltip00298" data-tooltip-content="#tooltip_content00298" data-tooltip-anchor="#tooltip_content00298"><span class="kwb">ASTRA</span> <span class="kwb">MILITARUM</span> <span class="kwb">INFANTRY</span></span> models. Each <a class="kwbOne" href="/wh40k10ed/factions/astra-militarum/Infantry-Squad"><span class="kwb kwbo">HEAVY</span> <span class="kwb kwbo">WEAPONS</span> <span class="kwb kwbo">TEAM</span></a> model and Veteran <a class="kwbOne" href="/wh40k10ed/factions/astra-militarum/Infantry-Squad"><span class="kwb kwbo">HEAVY</span> <span class="kwb kwbo">WEAPONS</span> <span class="kwb kwbo">TEAM</span> <span class="kwb kwbo">MODEL</span></a> takes up the space of 2 models. Each <span class="tooltip01026" data-tooltip-content="#tooltip_content01026" data-tooltip-anchor="#tooltip_content01026"><span class="kwb">OGRYN</span></span> model takes up the space of 3 models. It cannot transport <span class="tooltip00300" data-tooltip-content="#tooltip_content00300" data-tooltip-anchor="#tooltip_content00300"><span class="kwb">ARTILLERY</span></span> models.|false|||||https://wahapedia.ru/wh40k10ed/factions/genestealer-cults/Storm-Chimera|
000003734|Aegis Defence Line|GC|000000016||Fortifications|||false|||||https://wahapedia.ru/wh40k10ed/factions/genestealer-cults/Aegis-Defence-Line|
000003735|Earthshaker Platform|GC|000000249||Fortifications|<b>This model is equipped with:</b> earthshaker cannon; close combat weapons.||false|||||https://wahapedia.ru/wh40k10ed/factions/genestealer-cults/Earthshaker-Platform|
000003736|Hydra Platform|GC|000000249||Fortifications|<b>This model is equipped with:</b> Hydra quad autocannon; close combat weapons.||false|||||https://wahapedia.ru/wh40k10ed/factions/genestealer-cults/Hydra-Platform|
000003737|Manticore Platform|GC|000000249||Fortifications|<b>This model is equipped with:</b> storm eagle rockets; close combat weapons.||false|||||https://wahapedia.ru/wh40k10ed/factions/genestealer-cults/Manticore-Platform|
000003738|Sabre Weapons Battery|GC|000000249||Fortifications|<b>Every model is equipped with:</b> twin heavy bolter; close combat weapon.||false|||||https://wahapedia.ru/wh40k10ed/factions/genestealer-cults/Sabre-Weapons-Battery|
000003739|Armoured Sentinels|GC|000000016||Other|<b>Every model is equipped with:</b> Militarum multi-laser; close combat weapon.||false|||||https://wahapedia.ru/wh40k10ed/factions/genestealer-cults/Armoured-Sentinels|
000003740|Attilan Rough Riders|GC|000000016||Other|<b>Every model is equipped with:</b> lasgun; laspistol; hunting lance; steed’s hooves.||false|||||https://wahapedia.ru/wh40k10ed/factions/genestealer-cults/Attilan-Rough-Riders|
000003741|Baneblade|GC|000000016||Other|<b>This model is equipped with:</b> Baneblade cannon; co-axial autocannon; demolisher cannon; heavy stubber; 2 lascannons; twin heavy bolter; 2 twin heavy flamers; armoured tracks.||false|||||https://wahapedia.ru/wh40k10ed/factions/genestealer-cults/Baneblade|
000003742|Banehammer|GC|000000016||Other|<b>This model is equipped with:</b> 2 lascannons; tremor cannon; twin heavy bolter; 2 twin heavy flamers; armoured tracks.|This model has a transport capacity of 26 <span class="tooltip00298" data-tooltip-content="#tooltip_content00298" data-tooltip-anchor="#tooltip_content00298"><span class="kwb">ASTRA</span> <span class="kwb">MILITARUM</span> <span class="kwb">INFANTRY</span></span> models. Each <a class="kwbOne" href="/wh40k10ed/factions/astra-militarum/Infantry-Squad"><span class="kwb kwbo">HEAVY</span> <span class="kwb kwbo">WEAPONS</span> <span class="kwb kwbo">TEAM</span></a> model and <a class="kwbOne" href="/wh40k10ed/factions/astra-militarum/Platoon-Command-Squad"><span class="kwb kwbo">VETERAN</span> <span class="kwb kwbo">HEAVY</span> <span class="kwb kwbo">WEAPONS</span> <span class="kwb kwbo">TEAM</span></a> model takes up the space of 2 models. Each <span class="tooltip01026" data-tooltip-content="#tooltip_content01026" data-tooltip-anchor="#tooltip_content01026"><span class="kwb">OGRYN</span></span> model takes up the space of 3 models. It cannot transport <span class="tooltip00300" data-tooltip-content="#tooltip_content00300" data-tooltip-anchor="#tooltip_content00300"><span class="kwb">ARTILLERY</span></span> models.|false|||||https://wahapedia.ru/wh40k10ed/factions/genestealer-cults/Banehammer|
000003743|Banesword|GC|000000016||Other|<b>This model is equipped with:</b> 2 lascannons; quake cannon; twin heavy bolter; 2 twin heavy flamers; armoured tracks.||false|||||https://wahapedia.ru/wh40k10ed/factions/genestealer-cults/Banesword|
000003744|Basilisk|GC|000000016||Other|<b>This model is equipped with:</b> earthshaker cannon; heavy bolter; armoured tracks.||false|||||https://wahapedia.ru/wh40k10ed/factions/genestealer-cults/Basilisk|
000003745|Deathstrike|GC|000000016||Other|<b>This model is equipped with:</b> heavy bolter; Deathstrike missile; armoured tracks.||false|||||https://wahapedia.ru/wh40k10ed/factions/genestealer-cults/Deathstrike|
000003746|Doomhammer|GC|000000016||Other|<b>This model is equipped with:</b> 2 lascannons; magma cannon; twin heavy bolter; 2 twin heavy flamers; armoured tracks.|This model has a transport capacity of 26 <span class="tooltip00298" data-tooltip-content="#tooltip_content00298" data-tooltip-anchor="#tooltip_content00298"><span class="kwb">ASTRA</span> <span class="kwb">MILITARUM</span> <span class="kwb">INFANTRY</span></span> models. Each <a class="kwbOne" href="/wh40k10ed/factions/astra-militarum/Infantry-Squad"><span class="kwb kwbo">HEAVY</span> <span class="kwb kwbo">WEAPONS</span> <span class="kwb kwbo">TEAM</span></a> model and <a class="kwbOne" href="/wh40k10ed/factions/astra-militarum/Platoon-Command-Squad"><span class="kwb kwbo">VETERAN</span> <span class="kwb kwbo">HEAVY</span> <span class="kwb kwbo">WEAPONS</span> <span class="kwb kwbo">TEAM</span></a> model takes up the space of 2 models. Each <span class="tooltip01026" data-tooltip-content="#tooltip_content01026" data-tooltip-anchor="#tooltip_content01026"><span class="kwb">OGRYN</span></span> model takes up the space of 3 models. It cannot transport <span class="tooltip00300" data-tooltip-content="#tooltip_content00300" data-tooltip-anchor="#tooltip_content00300"><span class="kwb">ARTILLERY</span></span> models.|false|||||https://wahapedia.ru/wh40k10ed/factions/genestealer-cults/Doomhammer|
000003747|Field Ordnance Battery|GC|000000016||Other|<b>Every model is equipped with:</b> malleus rocket launcher; lasgun; laspistol; battery close combat weapons.||false|||||https://wahapedia.ru/wh40k10ed/factions/genestealer-cults/Field-Ordnance-Battery|
000003748|Heavy Weapons Squad|GC|000000016||Other|<b>Every model is equipped with:</b> heavy bolter; las small arms; weapons team close combat weapons.||false|||||https://wahapedia.ru/wh40k10ed/factions/genestealer-cults/Heavy-Weapons-Squad|
000003749|Hellhammer|GC|000000016||Other|<b>This model is equipped with:</b> co-axial autocannon; demolisher cannon; heavy stubber; Hellhammer cannon; 2 lascannons; twin heavy bolter; 2 twin heavy flamers; armoured tracks.||false|||||https://wahapedia.ru/wh40k10ed/factions/genestealer-cults/Hellhammer|
000003750|Hellhound|GC|000000016||Other|<b>This model is equipped with:</b> heavy flamer; inferno cannon; armoured tracks.||false|||||https://wahapedia.ru/wh40k10ed/factions/genestealer-cults/Hellhound|
000003751|Hydra|GC|000000016||Other|<b>This model is equipped with:</b> heavy bolter; Hydra autocannon; armoured tracks.||false|||||https://wahapedia.ru/wh40k10ed/factions/genestealer-cults/Hydra|
000003752|Kasrkin|GC|000000016||Other|<b>The Kasrkin Sergeant is equipped with:</b> hot-shot laspistol; chainsword. <br><br><b>Every Kasrkin Trooper is equipped with:</b> hot-shot lasgun; close combat weapon.||false|||||https://wahapedia.ru/wh40k10ed/factions/genestealer-cults/Kasrkin|
000003753|Leman Russ Battle Tank|GC|000000016||Other|<b>This model is equipped with:</b> lascannon; Leman Russ battle cannon; armoured tracks.||false|||||https://wahapedia.ru/wh40k10ed/factions/genestealer-cults/Leman-Russ-Battle-Tank|
000003754|Leman Russ Demolisher|GC|000000016||Other|<b>This model is equipped with:</b> demolisher battle cannon; lascannon; armoured tracks.||false|||||https://wahapedia.ru/wh40k10ed/factions/genestealer-cults/Leman-Russ-Demolisher|
000003755|Leman Russ Eradicator|GC|000000016||Other|<b>This model is equipped with:</b> eradicator nova cannon; lascannon; armoured tracks.||false|||||https://wahapedia.ru/wh40k10ed/factions/genestealer-cults/Leman-Russ-Eradicator|
000003756|Leman Russ Executioner|GC|000000016||Other|<b>This model is equipped with:</b> executioner plasma cannon; lascannon; armoured tracks.||false|||||https://wahapedia.ru/wh40k10ed/factions/genestealer-cults/Leman-Russ-Executioner|
000003757|Leman Russ Exterminator|GC|000000016||Other|<b>This model is equipped with:</b> exterminator autocannon; lascannon; armoured tracks.||false|||||https://wahapedia.ru/wh40k10ed/factions/genestealer-cults/Leman-Russ-Exterminator|
000003758|Leman Russ Punisher|GC|000000016||Other|<b>This model is equipped with:</b> lascannon; punisher gatling cannon; armoured tracks.||false|||||https://wahapedia.ru/wh40k10ed/factions/genestealer-cults/Leman-Russ-Punisher|
000003759|Leman Russ Vanquisher|GC|000000016||Other|<b>This model is equipped with:</b> lascannon; vanquisher battle cannon; armoured tracks.||false|||||https://wahapedia.ru/wh40k10ed/factions/genestealer-cults/Leman-Russ-Vanquisher|
000003760|Manticore|GC|000000016||Other|<b>This model is equipped with:</b> heavy bolter; storm eagle rockets; armoured tracks.||false|||||https://wahapedia.ru/wh40k10ed/factions/genestealer-cults/Manticore|
000003761|Munitorum Servitors|GC|000000016||Other|<b>Every model is equipped with:</b> Servitor’s servo-arm.||false|||||https://wahapedia.ru/wh40k10ed/factions/genestealer-cults/Munitorum-Servitors|
000003762|Regimental Attachés|GC|000000016||Other|<b>The Master of Ordnance and Officer of the Fleet are both equipped with:</b> laspistol; close combat weapon. <br><br><b>The Astropath is equipped with:</b> laspistol; Astropath’s stave.||false|||||https://wahapedia.ru/wh40k10ed/factions/genestealer-cults/Regimental-Attach-s|
000003763|Rogal Dorn Battle Tank|GC|000000016||Other|<b>This model is equipped with:</b> castigator gatling cannon; heavy stubber; twin battle cannon; armoured tracks.||false|||||https://wahapedia.ru/wh40k10ed/factions/genestealer-cults/Rogal-Dorn-Battle-Tank|
000003764|Scout Sentinels|GC|000000016||Other|<b>Every model is equipped with:</b> Militarum multi-laser; close combat weapon.||false|||||https://wahapedia.ru/wh40k10ed/factions/genestealer-cults/Scout-Sentinels|
000003765|Shadowsword|GC|000000016||Other|This model is equipped with: 2 lascannons; twin heavy bolter; 2 twin heavy flamers; volcano cannon; armoured tracks.||false|||||https://wahapedia.ru/wh40k10ed/factions/genestealer-cults/Shadowsword|
000003766|Stormlord|GC|000000016||Other|<b>This model is equipped with:</b> 2 heavy stubbers; 2 lascannons; twin heavy bolter; 2 twin heavy flamers; vulcan mega-bolter; armoured tracks|This model has a transport capacity of 40 <span class="tooltip00298" data-tooltip-content="#tooltip_content00298" data-tooltip-anchor="#tooltip_content00298"><span class="kwb">ASTRA</span> <span class="kwb">MILITARUM</span> <span class="kwb">INFANTRY</span></span> models. Each <a class="kwbOne" href="/wh40k10ed/factions/astra-militarum/Infantry-Squad"><span class="kwb kwbo">HEAVY</span> <span class="kwb kwbo">WEAPONS</span> <span class="kwb kwbo">TEAM</span></a> model and <a class="kwbOne" href="/wh40k10ed/factions/astra-militarum/Platoon-Command-Squad"><span class="kwb kwbo">VETERAN</span> <span class="kwb kwbo">HEAVY</span> <span class="kwb kwbo">WEAPONS</span> <span class="kwb kwbo">TEAM</span></a> model takes up the space of 2 models. Each <span class="tooltip01026" data-tooltip-content="#tooltip_content01026" data-tooltip-anchor="#tooltip_content01026"><span class="kwb">OGRYN</span></span> model takes up the space of 3 models. It cannot transport <span class="tooltip00300" data-tooltip-content="#tooltip_content00300" data-tooltip-anchor="#tooltip_content00300"><span class="kwb">ARTILLERY</span></span> models.|false|||||https://wahapedia.ru/wh40k10ed/factions/genestealer-cults/Stormlord|
000003767|Stormsword|GC|000000016||Other|<b>This model is equipped with:</b> 2 lascannons; Stormsword siege cannon; twin heavy bolter; 2 twin heavy flamers; armoured tracks.||false|||||https://wahapedia.ru/wh40k10ed/factions/genestealer-cults/Stormsword|
